{
  "schema_version": "1.0.0",
  "policy_id": "AIHD-EXTERNAL-SOURCES",
  "revision": "1.0.0",
  "owner": "AI Native Helpdesk Owner",
  "effective_at": "2026-08-17T16:00:00Z",
  "expires_at": "2026-11-17T16:00:00Z",
  "sources": [
    {
      "source_id": "OPENAI_OFFICIAL_DOCS",
      "owner": "OpenAI",
      "status": "ACTIVE",
      "allowed_risks": [
        "LOW",
        "MEDIUM",
        "HIGH"
      ],
      "url_prefixes": [
        "https://developers.openai.com/",
        "https://help.openai.com/",
        "https://learn.chatgpt.com/",
        "https://platform.openai.com/"
      ],
      "stable_max_age_hours": 720,
      "dynamic_max_age_hours": 24,
      "invalidation_conditions": [
        "policy expired",
        "source status is not ACTIVE",
        "URL leaves an approved origin and path prefix",
        "evidence exceeds the applicable freshness window"
      ]
    },
    {
      "source_id": "OPENAI_OFFICIAL_GITHUB",
      "owner": "OpenAI",
      "status": "ACTIVE",
      "allowed_risks": [
        "LOW",
        "MEDIUM",
        "HIGH"
      ],
      "url_prefixes": [
        "https://github.com/openai/"
      ],
      "stable_max_age_hours": 720,
      "dynamic_max_age_hours": 24,
      "invalidation_conditions": [
        "policy expired",
        "source status is not ACTIVE",
        "repository ownership changes",
        "evidence exceeds the applicable freshness window"
      ]
    },
    {
      "source_id": "OPENCLAW_OFFICIAL_DOCS",
      "owner": "OpenClaw",
      "status": "ACTIVE",
      "allowed_risks": [
        "LOW",
        "MEDIUM",
        "HIGH"
      ],
      "url_prefixes": [
        "https://docs.openclaw.ai/"
      ],
      "stable_max_age_hours": 720,
      "dynamic_max_age_hours": 24,
      "invalidation_conditions": [
        "policy expired",
        "source status is not ACTIVE",
        "URL leaves the approved documentation origin",
        "evidence exceeds the applicable freshness window"
      ]
    },
    {
      "source_id": "OPENCLAW_OFFICIAL_GITHUB",
      "owner": "OpenClaw",
      "status": "ACTIVE",
      "allowed_risks": [
        "LOW",
        "MEDIUM",
        "HIGH"
      ],
      "url_prefixes": [
        "https://github.com/openclaw/openclaw/"
      ],
      "stable_max_age_hours": 720,
      "dynamic_max_age_hours": 24,
      "invalidation_conditions": [
        "policy expired",
        "source status is not ACTIVE",
        "repository ownership changes",
        "evidence exceeds the applicable freshness window"
      ]
    }
  ]
}
